{
  "fipVersion": "0.2",
  "document": "AuthorityPolicy",
  "status": "ENFORCEMENT CANDIDATE",
  "mode": "operational",
  "policyId": "pol-files",
  "traceId": "trace-files",
  "actors": [
    {"id": "agent-field", "identity": "id-agent-field"}
  ],
  "resources": [
    {"id": "mission:InspectionInput"},
    {"id": "mission:InspectionOutput"}
  ],
  "actions": [
    {"id": "ReadInspectionInput", "resourceId": "mission:InspectionInput"},
    {"id": "WriteInspectionOutput", "resourceId": "mission:InspectionOutput"}
  ],
  "authorities": [
    {"id": "auth-mission-control", "kind": "direct"}
  ],
  "executionBindings": [
    {
      "bindingId": "in-read",
      "resourceId": "mission:InspectionInput",
      "actionId": "ReadInspectionInput",
      "kind": "filesystem",
      "operation": "read",
      "locator": {"path": "/mission/input"},
      "lifetime": "establishment-bound"
    },
    {
      "bindingId": "out-write",
      "resourceId": "mission:InspectionOutput",
      "actionId": "WriteInspectionOutput",
      "kind": "filesystem",
      "operation": "write",
      "locator": {"path": "/mission/output"},
      "lifetime": "establishment-bound"
    }
  ],
  "enforcementRequirements": [
    {
      "requirementId": "req-read",
      "effect": "permit",
      "bindingIds": ["in-read"],
      "composition": "allOf",
      "groupId": "files",
      "audit": "correlated",
      "lifetime": "establishment-bound"
    },
    {
      "requirementId": "req-write",
      "effect": "permit",
      "bindingIds": ["out-write"],
      "composition": "allOf",
      "groupId": "files",
      "audit": "correlated",
      "lifetime": "establishment-bound"
    }
  ],
  "authorizations": [
    {
      "authorizationId": "az-files",
      "actorId": "agent-field",
      "authorityId": "auth-mission-control",
      "actionIds": ["ReadInspectionInput", "WriteInspectionOutput"],
      "resourceIds": ["mission:InspectionInput", "mission:InspectionOutput"],
      "purpose": "FieldInspection",
      "requirementIds": ["req-read", "req-write"],
      "validity": {"state": "valid"}
    }
  ],
  "obligations": [
    {
      "obligationId": "obl-audit-files",
      "actionIds": ["ReadInspectionInput", "WriteInspectionOutput"],
      "requirementIds": ["req-read", "req-write"]
    }
  ],
  "validity": {"state": "valid"},
  "provenance": {
    "assertedBy": "mission-control",
    "derivedFrom": ["trace-files"],
    "independent": true,
    "traceId": "trace-files"
  }
}
