{
  "fipVersion": "0.2",
  "document": "AuthorityPolicy",
  "status": "ENFORCEMENT CANDIDATE",
  "mode": "operational",
  "policyId": "pol-q13b-read",
  "traceId": "trace-openshell-files",
  "actors": [
    {
      "id": "agent-field",
      "identity": "id-agent-field"
    }
  ],
  "resources": [
    {
      "id": "mission:InspectionInput"
    },
    {
      "id": "mission:InspectionOutput"
    }
  ],
  "actions": [
    {
      "id": "ReadInspectionInput",
      "resourceId": "mission:InspectionInput"
    },
    {
      "id": "WriteInspectionOutput",
      "resourceId": "mission:InspectionOutput"
    }
  ],
  "authorities": [
    {
      "id": "auth-mission-control",
      "kind": "direct"
    }
  ],
  "executionBindings": [
    {
      "bindingId": "in-read",
      "resourceId": "mission:InspectionInput",
      "actionId": "ReadInspectionInput",
      "kind": "filesystem",
      "operation": "read",
      "locator": {
        "path": "/mission/*"
      },
      "lifetime": "establishment-bound"
    },
    {
      "bindingId": "out-write",
      "resourceId": "mission:InspectionOutput",
      "actionId": "WriteInspectionOutput",
      "kind": "filesystem",
      "operation": "write",
      "locator": {
        "path": "/mission/output"
      },
      "lifetime": "establishment-bound"
    }
  ],
  "enforcementRequirements": [
    {
      "requirementId": "req-read",
      "effect": "permit",
      "bindingIds": [
        "in-read"
      ],
      "composition": "allOf",
      "groupId": "read-only",
      "audit": "target-native",
      "lifetime": "establishment-bound"
    },
    {
      "requirementId": "req-write",
      "effect": "permit",
      "bindingIds": [
        "out-write"
      ],
      "composition": "allOf",
      "groupId": "files",
      "audit": "target-native",
      "lifetime": "establishment-bound"
    }
  ],
  "authorizations": [
    {
      "authorizationId": "az-openshell-files",
      "actorId": "agent-field",
      "authorityId": "auth-mission-control",
      "actionIds": [
        "ReadInspectionInput"
      ],
      "resourceIds": [
        "mission:InspectionInput"
      ],
      "purpose": "FieldInspection",
      "requirementIds": [
        "req-read"
      ],
      "validity": {
        "state": "valid"
      }
    }
  ],
  "validity": {
    "state": "valid"
  },
  "provenance": {
    "assertedBy": "mission-control",
    "derivedFrom": [
      "trace-openshell-files"
    ],
    "independent": true,
    "traceId": "trace-openshell-files"
  }
}
