{
  "fipVersion": "0.2",
  "document": "AuthorityPolicy",
  "status": "ENFORCEMENT CANDIDATE",
  "mode": "operational",
  "policyId": "pol-credential",
  "traceId": "trace-credential",
  "actors": [
    {"id": "agent-field", "identity": "id-agent-field"}
  ],
  "resources": [
    {"id": "credential:FieldModel"}
  ],
  "actions": [
    {"id": "UseFieldModelCredential", "resourceId": "credential:FieldModel"}
  ],
  "authorities": [
    {"id": "auth-mission-control", "kind": "direct"}
  ],
  "executionBindings": [
    {
      "bindingId": "model-credential",
      "resourceId": "credential:FieldModel",
      "actionId": "UseFieldModelCredential",
      "kind": "credential",
      "operation": "invoke",
      "locator": {"serviceId": "credential:FieldModel"},
      "disclosure": "proxy-mediated",
      "lifetime": "revocable"
    }
  ],
  "enforcementRequirements": [
    {
      "requirementId": "req-credential-use",
      "effect": "permit",
      "bindingIds": ["model-credential"],
      "composition": "allOf",
      "groupId": "credential-use",
      "audit": "correlated",
      "lifetime": "revocable"
    },
    {
      "requirementId": "req-no-other-credentials",
      "effect": "deny",
      "bindingPattern": {
        "kinds": ["credential"],
        "exceptBindingIds": ["model-credential"]
      },
      "composition": "allOf",
      "groupId": "credential-deny",
      "audit": "target-native"
    }
  ],
  "prohibitions": [
    {
      "prohibitionId": "proh-other-credentials",
      "requirementIds": ["req-no-other-credentials"],
      "bindingPattern": {
        "kinds": ["credential"],
        "exceptBindingIds": ["model-credential"]
      }
    }
  ],
  "authorizations": [
    {
      "authorizationId": "az-credential",
      "actorId": "agent-field",
      "authorityId": "auth-mission-control",
      "actionIds": ["UseFieldModelCredential"],
      "resourceIds": ["credential:FieldModel"],
      "purpose": "FieldInspection",
      "requirementIds": ["req-credential-use"],
      "validity": {"state": "valid"}
    }
  ],
  "validity": {"state": "valid"},
  "provenance": {
    "assertedBy": "mission-control",
    "derivedFrom": ["trace-credential"],
    "independent": true,
    "traceId": "trace-credential"
  }
}
